Codec: Nvidia GPU 71 HDMI/DP
Address: 0
AFG Function Id: 0x1 (unsol 0)
Vendor Id: 0x10de0071
Subsystem Id: 0x15586540
Revision Id: 0x100100
No Modem Function Group found
Default PCM:
    rates [0x0]:
    bits [0x0]:
    formats [0x0]:
Default Amp-In caps: N/A
Default Amp-Out caps: N/A
State of AFG node 0x01:
  Power states:  D0 D1 D2 D3 CLKSTOP EPSS
  Power: setting=D0, actual=D0
GPIO: io=0, o=0, i=0, unsolicited=0, wake=0
Node 0x04 [Pin Complex] wcaps 0x407381: 8-Channels Digital CP
  Control: name="IEC958 Playback Con Mask", index=0, device=0
  Control: name="IEC958 Playback Pro Mask", index=0, device=0
  Control: name="IEC958 Playback Default", index=0, device=0
  Control: name="IEC958 Playback Switch", index=0, device=0
  Control: name="ELD", index=0, device=3
  Pincap 0x09000094: OUT Detect HBR HDMI DP
  Pin Default 0x185600f0: [Jack] Digital Out at Int HDMI
    Conn = Digital, Color = Unknown
    DefAssociation = 0xf, Sequence = 0x0
  Pin-ctls: 0x00:
  Unsolicited: tag=01, enabled=1
  Connection: 4
     0x08* 0x09 0x0a 0x0b
Node 0x05 [Pin Complex] wcaps 0x407381: 8-Channels Digital CP
  Control: name="IEC958 Playback Con Mask", index=1, device=0
  Control: name="IEC958 Playback Pro Mask", index=1, device=0
  Control: name="IEC958 Playback Default", index=1, device=0
  Control: name="IEC958 Playback Switch", index=1, device=0
  Control: name="ELD", index=0, device=7
  Pincap 0x09000094: OUT Detect HBR HDMI DP
  Pin Default 0x185600f0: [Jack] Digital Out at Int HDMI
    Conn = Digital, Color = Unknown
    DefAssociation = 0xf, Sequence = 0x0
  Pin-ctls: 0x00:
  Unsolicited: tag=02, enabled=1
  Connection: 4
     0x08* 0x09 0x0a 0x0b
Node 0x06 [Pin Complex] wcaps 0x407381: 8-Channels Digital CP
  Control: name="IEC958 Playback Con Mask", index=2, device=0
  Control: name="IEC958 Playback Pro Mask", index=2, device=0
  Control: name="IEC958 Playback Default", index=2, device=0
  Control: name="IEC958 Playback Switch", index=2, device=0
  Control: name="ELD", index=0, device=8
  Pincap 0x09000094: OUT Detect HBR HDMI DP
  Pin Default 0x185600f0: [Jack] Digital Out at Int HDMI
    Conn = Digital, Color = Unknown
    DefAssociation = 0xf, Sequence = 0x0
  Pin-ctls: 0x00:
  Unsolicited: tag=03, enabled=1
  Connection: 4
     0x08* 0x09 0x0a 0x0b
Node 0x07 [Pin Complex] wcaps 0x407381: 8-Channels Digital CP
  Control: name="IEC958 Playback Con Mask", index=3, device=0
  Control: name="IEC958 Playback Pro Mask", index=3, device=0
  Control: name="IEC958 Playback Default", index=3, device=0
  Control: name="IEC958 Playback Switch", index=3, device=0
  Control: name="ELD", index=0, device=9
  Pincap 0x09000094: OUT Detect HBR HDMI DP
  Pin Default 0x185600f0: [Jack] Digital Out at Int HDMI
    Conn = Digital, Color = Unknown
    DefAssociation = 0xf, Sequence = 0x0
  Pin-ctls: 0x00:
  Unsolicited: tag=04, enabled=1
  Connection: 4
     0x08* 0x09 0x0a 0x0b
Node 0x08 [Audio Output] wcaps 0x62b1: 8-Channels Digital Stripe
  Converter: stream=5, channel=0
  Digital: Enabled
  Digital category: 0x0
  IEC Coding Type: 0x0
  PCM:
    rates [0x7f0]: 32000 44100 48000 88200 96000 176400 192000
    bits [0xe]: 16 20 24
    formats [0x5]: PCM AC3
  Unsolicited: tag=00, enabled=0
Node 0x09 [Audio Output] wcaps 0x62b1: 8-Channels Digital Stripe
  Converter: stream=0, channel=0
  Digital:
  Digital category: 0x0
  IEC Coding Type: 0x0
  PCM:
    rates [0x7f0]: 32000 44100 48000 88200 96000 176400 192000
    bits [0xe]: 16 20 24
    formats [0x5]: PCM AC3
  Unsolicited: tag=00, enabled=0
Node 0x0a [Audio Output] wcaps 0x62b1: 8-Channels Digital Stripe
  Converter: stream=0, channel=0
  Digital:
  Digital category: 0x0
  IEC Coding Type: 0x0
  PCM:
    rates [0x7f0]: 32000 44100 48000 88200 96000 176400 192000
    bits [0xe]: 16 20 24
    formats [0x5]: PCM AC3
  Unsolicited: tag=00, enabled=0
Node 0x0b [Audio Output] wcaps 0x62b1: 8-Channels Digital Stripe
  Converter: stream=0, channel=0
  Digital:
  Digital category: 0x0
  IEC Coding Type: 0x0
  PCM:
    rates [0x7f0]: 32000 44100 48000 88200 96000 176400 192000
    bits [0xe]: 16 20 24
    formats [0x5]: PCM AC3
  Unsolicited: tag=00, enabled=0
